{
  "schema_version": "1.0",
  "case_id": "rl-01",
  "protocol": "rail",
  "language": "English",
  "goal": "Make the supplier-information assignment executable without authorizing a purchase.",
  "sender_role": "Owner",
  "recipient_role": "Operations assistant",
  "context": "",
  "material": "Please check the consumable with the suppliers.",
  "evidence": [
    {
      "id": "E1",
      "text": "The operator gathers compatibility information and quotes from the two supplied suppliers.",
      "kind": "user_assertion"
    },
    {
      "id": "E2",
      "text": "The technical lead decides compatibility.",
      "kind": "user_assertion"
    },
    {
      "id": "E3",
      "text": "Only the owner may authorize a purchase.",
      "kind": "user_assertion"
    },
    {
      "id": "E4",
      "text": "Supplier labels in this synthetic case are Vendor A and Vendor B; no real contacts are provided.",
      "kind": "user_assertion"
    }
  ],
  "material_conditions": [
    "E2",
    "E3"
  ],
  "verbatim_terms": [
    "Only the owner may authorize a purchase."
  ],
  "privacy_ok": true
}
